{
  "evidence_id": "ev-demo-allowed-0001",
  "tool_execution_id": "exec-demo-allowed-0001",
  "tool_action_request_id": "tar-demo-allowed-0001",
  "authorization_decision_id": "authz-demo-allowed-0001",
  "target_id": "webapp-demo-001",
  "scope_id": "scope-demo-001",
  "tool": "zap",
  "operation": "authenticated_crawl",
  "credential_ref_used": "test-account-001",
  "secret_exposed_to_ai": false,
  "raw_artifact_ref": "private-not-in-git/raw-artifacts/zap/exec-demo-allowed-0001.json",
  "sanitized_artifact_ref": "prototypes/tool-gateway/examples/sanitized/exec-demo-allowed-0001.json",
  "sanitization_status": "completed",
  "finding_candidate_ids": [
    "finding-demo-001"
  ],
  "human_review_status": "pending",
  "created_at": "2026-05-02T10:03:30Z"
}
